{
  "schema_version": "1.0",
  "review_id": "rev-solvability-20260731-001",
  "project_id": "clr-2026-large-print-sudoku-for-seniors-easy-puzzles-with",
  "reviewer_role": "content-verifier",
  "artifact_id": "art-content-sudoku-69175ea7b7f2",
  "artifact_hash": "sha256:69175ea7b7f22edc3cacb443ac17b9e599ea3831285d8f61a6e5b6edc54bdaf7",
  "review_type": "solvability-and-difficulty",
  "decision": "PASS",
  "scores": {
    "solvability": 5,
    "difficulty-label-accuracy": 5,
    "difficulty-progression": 4,
    "batch-integrity": 5
  },
  "findings": [
    {
      "finding_id": "fnd-progression-generator-001",
      "reviewer_role": "content-verifier",
      "artifact_id": "art-content-sudoku-69175ea7b7f2",
      "artifact_hash": "sha256:69175ea7b7f22edc3cacb443ac17b9e599ea3831285d8f61a6e5b6edc54bdaf7",
      "severity": "note",
      "dimension": "difficulty-progression",
      "location": "content/puzzles/sudoku-batch.json — all 100 puzzles",
      "observation": "All 100 puzzles have an identical given_count of 40 (min=max=40). The generator does not implement a givens gradient even when params specify givens_progression=true. The progression is flat within the easy tier. For a senior-large-print single-tier easy book, uniform difficulty is acceptable and may be preferable (predictable experience for seniors). The content_plan declares difficulty_progression=progressive; this is best interpreted as section-order progression (puzzles before solutions) rather than a within-tier difficulty gradient.",
      "evidence": "Batch params: {givens_progression: true, givens_start: 45, givens_end: 36}. Actual payload given_count: all 40 (min=max=40, unique_values=[40]). Code verifier PASS 100/100. Generator does not vary givens per puzzle index. content_plan.difficulty_progression='progressive', content_plan.difficulty_tiers=['easy'] (single tier).",
      "recommendation": "Update content_plan_notes to explicitly state that 'progressive' refers to section-order layout (puzzles then solutions) within a uniform easy tier, not a within-puzzle difficulty gradient. Record as a documented generator limitation for future engine improvement. No content regeneration needed for this edition.",
      "acceptance_test": "content_plan_notes updated to clarify 'progressive' means section-order layout for this single easy-tier edition. Finding closed.",
      "status": "accepted",
      "resolution_notes": "Single easy tier for senior-large-print audience: uniform difficulty (40 givens) is within spec [36,45], label is correct, and a flat experience is audience-appropriate. Generator limitation noted; not a content defect for this edition.",
      "confidence": 0.95
    },
    {
      "finding_id": "fnd-difficulty-label-001",
      "reviewer_role": "content-verifier",
      "artifact_id": "art-content-sudoku-69175ea7b7f2",
      "artifact_hash": "sha256:69175ea7b7f22edc3cacb443ac17b9e599ea3831285d8f61a6e5b6edc54bdaf7",
      "severity": "note",
      "dimension": "difficulty-label-accuracy",
      "location": "content/puzzles/sudoku-batch.json — batch difficulty field",
      "observation": "The 'easy' difficulty label is accurate. 40 givens is within the spec range [36,45] and consistent with standard easy-sudoku convention for 9x9 puzzles.",
      "evidence": "project.yaml givens_range_easy=[36,45]. All 100 puzzles: given_count=40. Code verifier PASS 100/100 unique solutions.",
      "recommendation": "No action required.",
      "acceptance_test": "Already met.",
      "status": "closed",
      "confidence": 0.98
    },
    {
      "finding_id": "fnd-solvability-001",
      "reviewer_role": "content-verifier",
      "artifact_id": "art-content-sudoku-69175ea7b7f2",
      "artifact_hash": "sha256:69175ea7b7f22edc3cacb443ac17b9e599ea3831285d8f61a6e5b6edc54bdaf7",
      "severity": "note",
      "dimension": "solvability",
      "location": "verification/content-verification-latest.json",
      "observation": "Code verifier (independent of generator) confirmed 100/100 puzzles uniquely solvable with correct answer keys. 0 failed items.",
      "evidence": "verification/content-verification-latest.json: decision=PASS, item_count=100, passed_count=100, failed_items=[]. 'Each item re-verified independently of its generator (code verifies code).'",
      "recommendation": "No action required.",
      "acceptance_test": "Already met.",
      "status": "closed",
      "confidence": 1.0
    }
  ],
  "summary": "100 easy sudoku puzzles are 100% uniquely solvable with correct answer keys (code-verified, independent of generator). The 'easy' difficulty label is accurate (40 givens, within spec [36,45]). The generator produces uniform givens and does not vary within the easy tier — this is a documented generator limitation, not a content defect. For a senior-large-print single-tier easy edition, uniform difficulty is audience-appropriate. All findings are notes or accepted; no blockers or majors.",
  "limitations": [
    "Difficulty assessment based on givens count; no constraint-propagation depth scoring applied.",
    "Generator does not implement within-tier givens progression; params are accepted but produce uniform output.",
    "Solvability cited from independent code verifier, not re-derived by inspection."
  ],
  "completed_at": "2026-07-31T13:04:45Z"
}
